{
  "schema_version": "vista.playable-action-catalog/v1",
  "catalog_id": "vista_indoor_actions",
  "catalog_revision": "vista_indoor_actions_r1",
  "animation_profile_binding": {
    "profile_id": "ue_5_7_3_animation_v1",
    "profile_revision": "t12_source_inventory_r1",
    "content_digest": "4a7947cd9f1a6edfaad32cc459d7193452dc938bccdb492ffa94af0af17320bd",
    "acceptance_state": "source_inventory_only"
  },
  "acceptance_thresholds": {
    "motion_warp_position_cm": 5,
    "motion_warp_yaw_deg": 5,
    "hand_contact_cm": 4,
    "two_hand_contact_cm": 5,
    "foot_penetration_cm": 1,
    "attachment_pop_cm": 2,
    "attachment_pop_deg": 3,
    "seat_pelvis_cm": 3,
    "seat_pelvis_yaw_deg": 5,
    "recover_root_cm": 5
  },
  "control_intents": [
    {
      "intent_id": "speak",
      "wire_action": "speak",
      "backend_action": "Speak",
      "required_parameters": ["utterance"],
      "optional_parameters": ["timeout_s"]
    }
  ],
  "actions": [
    {
      "action_id": "idle", "family": "locomotion", "aliases": [],
      "target_policy": "forbidden", "approach_policy": "none",
      "parameters": {"required": [], "optional": ["duration_s", "pose"]},
      "effect": {"effect_id": "actor_pose", "commit_phase": "completion"},
      "rollback_policy": "not_applicable", "default_variant_id": "idle.neutral",
      "legacy_bindings": [],
      "variants": [
        {"variant_id": "idle.neutral", "selectors": {"pose": "standing"}, "readiness": "candidate", "animation_profile_action_id": "idle", "rejection_reason": null}
      ]
    },
    {
      "action_id": "walk", "family": "locomotion", "aliases": ["navigate_to"],
      "target_policy": "optional", "approach_policy": "navigate",
      "parameters": {"required": ["room_id"], "optional": ["target_id", "distance_cm"]},
      "effect": {"effect_id": "actor_motion", "commit_phase": "completion"},
      "rollback_policy": "not_applicable", "default_variant_id": "walk.forward",
      "legacy_bindings": [
        {"wire_action": "navigate_to", "backend_action": "NavigateTo", "variant_id": "walk.forward"}
      ],
      "variants": [
        {"variant_id": "walk.forward", "selectors": {"direction": "forward"}, "readiness": "candidate", "animation_profile_action_id": "locomotion", "rejection_reason": null}
      ]
    },
    {
      "action_id": "jog", "family": "locomotion", "aliases": [],
      "target_policy": "optional", "approach_policy": "navigate",
      "parameters": {"required": ["room_id"], "optional": ["target_id", "distance_cm"]},
      "effect": {"effect_id": "actor_motion", "commit_phase": "completion"},
      "rollback_policy": "not_applicable", "default_variant_id": "jog.forward",
      "legacy_bindings": [],
      "variants": [
        {"variant_id": "jog.forward", "selectors": {"direction": "forward"}, "readiness": "candidate", "animation_profile_action_id": "locomotion", "rejection_reason": null}
      ]
    },
    {
      "action_id": "sprint", "family": "locomotion", "aliases": [],
      "target_policy": "optional", "approach_policy": "navigate",
      "parameters": {"required": ["room_id"], "optional": ["target_id", "distance_cm"]},
      "effect": {"effect_id": "actor_motion", "commit_phase": "completion"},
      "rollback_policy": "not_applicable", "default_variant_id": "sprint.forward",
      "legacy_bindings": [],
      "variants": [
        {"variant_id": "sprint.forward", "selectors": {"direction": "forward"}, "readiness": "candidate", "animation_profile_action_id": "locomotion", "rejection_reason": null}
      ]
    },
    {
      "action_id": "turn_in_place", "family": "locomotion", "aliases": ["turn"],
      "target_policy": "optional", "approach_policy": "none",
      "parameters": {"required": ["direction"], "optional": ["target_id"]},
      "effect": {"effect_id": "actor_pose", "commit_phase": "completion"},
      "rollback_policy": "not_applicable", "default_variant_id": "turn_in_place.left",
      "legacy_bindings": [],
      "variants": [
        {"variant_id": "turn_in_place.left", "selectors": {"direction": "left"}, "readiness": "blocked_on_source", "animation_profile_action_id": "turn", "rejection_reason": "No accepted in-place turn asset has been authored or packaged."},
        {"variant_id": "turn_in_place.right", "selectors": {"direction": "right"}, "readiness": "blocked_on_source", "animation_profile_action_id": "turn", "rejection_reason": "No accepted in-place turn asset has been authored or packaged."}
      ]
    },
    {
      "action_id": "crouch", "family": "posture", "aliases": [],
      "target_policy": "forbidden", "approach_policy": "none",
      "parameters": {"required": [], "optional": ["duration_s"]},
      "effect": {"effect_id": "actor_pose", "commit_phase": "completion"},
      "rollback_policy": "not_applicable", "default_variant_id": "crouch.standing_to_crouched",
      "legacy_bindings": [],
      "variants": [
        {"variant_id": "crouch.standing_to_crouched", "selectors": {"pose": "crouched"}, "readiness": "blocked_on_source", "animation_profile_action_id": null, "rejection_reason": "No catalog-bound crouch transition source is available."}
      ]
    },
    {
      "action_id": "look_at", "family": "attention", "aliases": [],
      "target_policy": "required", "approach_policy": "none",
      "parameters": {"required": ["target_id"], "optional": ["duration_s"]},
      "effect": {"effect_id": "actor_pose", "commit_phase": "completion"},
      "rollback_policy": "not_applicable", "default_variant_id": "look_at.aligned",
      "legacy_bindings": [
        {"wire_action": "look_at", "backend_action": "LookAt", "variant_id": "look_at.legacy_single_frame"}
      ],
      "variants": [
        {"variant_id": "look_at.aligned", "selectors": {"pose": "standing"}, "readiness": "blocked_on_source", "animation_profile_action_id": "look_at", "rejection_reason": "A sustained target-aligned look animation still needs authoring."},
        {"variant_id": "look_at.legacy_single_frame", "selectors": {"pose": "standing"}, "readiness": "rejected_placeholder", "animation_profile_action_id": "look_at", "rejection_reason": "The experimental 0.033 second montage is not a visible look-at action."}
      ]
    },
    {
      "action_id": "pause", "family": "attention", "aliases": ["wait"],
      "target_policy": "forbidden", "approach_policy": "none",
      "parameters": {"required": [], "optional": ["duration_s", "pose"]},
      "effect": {"effect_id": "actor_pose", "commit_phase": "completion"},
      "rollback_policy": "not_applicable", "default_variant_id": "pause.hold",
      "legacy_bindings": [
        {"wire_action": "wait", "backend_action": "Wait", "variant_id": "pause.hold"},
        {"wire_action": "pause", "backend_action": "Pause", "variant_id": "pause.hold"}
      ],
      "variants": [
        {"variant_id": "pause.hold", "selectors": {"pose": "standing"}, "readiness": "candidate", "animation_profile_action_id": "pause", "rejection_reason": null}
      ]
    },
    {
      "action_id": "pick_up", "family": "manipulation", "aliases": ["pickup"],
      "target_policy": "required", "approach_policy": "align_target",
      "parameters": {"required": ["target_id"], "optional": ["hand", "height_cm"]},
      "effect": {"effect_id": "held_state_claim", "commit_phase": "contact"},
      "rollback_policy": "restore_pre_contact", "default_variant_id": "pick_up.right_waist",
      "legacy_bindings": [
        {"wire_action": "pick_up", "backend_action": "PickUp", "variant_id": "pick_up.right_waist"}
      ],
      "variants": [
        {"variant_id": "pick_up.right_waist", "selectors": {"hand": "right", "height_band": "waist", "weight_band": "light"}, "readiness": "blocked_on_license", "animation_profile_action_id": "pickup", "rejection_reason": "The current pickup source awaits an explicit license acceptance receipt."},
        {"variant_id": "pick_up.both_floor_heavy", "selectors": {"hand": "both", "height_band": "floor", "weight_band": "heavy"}, "readiness": "blocked_on_source", "animation_profile_action_id": null, "rejection_reason": "A two-hand floor pickup source is not available."}
      ]
    },
    {
      "action_id": "carry", "family": "manipulation", "aliases": [],
      "target_policy": "optional", "approach_policy": "none",
      "parameters": {"required": [], "optional": ["target_id", "hand", "pose"]},
      "effect": {"effect_id": "actor_pose", "commit_phase": "completion"},
      "rollback_policy": "restore_pre_contact", "default_variant_id": "carry.right_light",
      "legacy_bindings": [],
      "variants": [
        {"variant_id": "carry.right_light", "selectors": {"hand": "right", "weight_band": "light", "pose": "standing"}, "readiness": "blocked_on_source", "animation_profile_action_id": null, "rejection_reason": "No carry overlay has been authored for the current skeleton."},
        {"variant_id": "carry.both_heavy", "selectors": {"hand": "both", "weight_band": "heavy", "pose": "standing"}, "readiness": "blocked_on_source", "animation_profile_action_id": null, "rejection_reason": "No two-hand heavy carry overlay has been authored."}
      ]
    },
    {
      "action_id": "place", "family": "manipulation", "aliases": [],
      "target_policy": "required", "approach_policy": "align_support",
      "parameters": {"required": ["target_id", "placement_anchor_id"], "optional": ["hand", "height_cm"]},
      "effect": {"effect_id": "held_state_release", "commit_phase": "release"},
      "rollback_policy": "restore_pre_contact", "default_variant_id": "place.right_counter",
      "legacy_bindings": [
        {"wire_action": "place", "backend_action": "Place", "variant_id": "place.right_counter"}
      ],
      "variants": [